{
  "$schema": "../../schemas/content-design.schema.json",
  "run_id": "example.ru.science-article:1",
  "design_revision": "design-1",
  "reader_promise": "General readers will understand which research details control a claim and why limitations belong beside the result.",
  "working_thesis": "Научный результат становится понятнее не после удаления оговорок, а когда статья показывает, какие границы определяют смысл вывода.",
  "sections_or_units": [
    {
      "id": "section-1",
      "purpose": "Показать, почему один и тот же результат меняет смысл без статуса публикации, метода и исследованной выборки.",
      "claim_ids": [
        "C-001"
      ]
    },
    {
      "id": "section-2",
      "purpose": "Объяснить, как компактная карточка исследования удерживает доказательные границы до начала черновика.",
      "claim_ids": [
        "C-002"
      ]
    },
    {
      "id": "section-3",
      "purpose": "Собрать практическую проверку статьи и явно отделить методический вывод от измеренного эффекта.",
      "claim_ids": [
        "C-001",
        "C-002"
      ]
    }
  ],
  "public_metadata": {
    "working_title": "Почему ограничения исследования должны оставаться рядом с результатом",
    "description": "Практический способ сохранить доказательные границы научного утверждения при подготовке статьи."
  },
  "visual_role": "Концептуальная схема пути от карточки исследования к ограниченному утверждению."
}
