{
  "$schema": "../../../../schemas/content-design.schema.json",
  "run_id": "pilot.ru.mysticism-article:1",
  "design_revision": "mysticism-design-1",
  "reader_promise": "Читатель поймёт, из каких элементов складывается работающая мистическая недосказанность и где тайна превращается в пустую туманность.",
  "working_thesis": "Мистическая недосказанность становится выразительным приёмом не тогда, когда история скрывает всё, а когда она показывает устойчивые последствия, ограничивает возможные объяснения и оставляет причину открытой.",
  "sections_or_units": [
    {
      "id": "opening",
      "purpose": "Развести видимый след и неизвестную причину на условном, явно вымышленном примере.",
      "claim_ids": [
        "C-002"
      ]
    },
    {
      "id": "bounded-unknown",
      "purpose": "Показать, что работающая тайна нуждается в последовательных ограничениях.",
      "claim_ids": [
        "C-001"
      ]
    },
    {
      "id": "consequences",
      "purpose": "Объяснить роль конкретного последствия, которое не доказывает единственную причину.",
      "claim_ids": [
        "C-002"
      ]
    },
    {
      "id": "empty-fog",
      "purpose": "Отличить недосказанность от произвольного отказа истории устанавливать связи.",
      "claim_ids": [
        "C-001"
      ]
    },
    {
      "id": "ending",
      "purpose": "Разобрать ограниченный редакционный критерий, по которому полное объяснение может ослабить финал.",
      "claim_ids": [
        "C-003"
      ]
    },
    {
      "id": "conclusion",
      "purpose": "Собрать практический тест работающей мистической тайны без универсальных заявлений о реакции аудитории.",
      "claim_ids": [
        "C-001",
        "C-002",
        "C-003"
      ]
    }
  ],
  "public_metadata": {
    "title": "Тень за дверью: как недосказанность работает в мистических историях",
    "description": "Почему мистической тайне нужны правила, конкретные последствия и пространство для нескольких объяснений."
  },
  "visual_role": "Широкая атмосферная обложка показывает видимый след и скрытую причину, не изображая конкретное существо или реальное место.",
  "adapter": {
    "id": "codex.pilot-editorial",
    "mode": "model",
    "version": "1"
  }
}
